Article_Name,Article_Link,Article_Text
Email: Archiving your email using Apple Mail,https://stolafcarleton.teamdynamix.com/TDClient/2092/Carleton/KB/ArticleDet?ID=143869,"Prepare to Archive Set up Apple Mail to access your Carleton gmail account: Click on the Apple menu and select System Preferences (macOS 11-12 ) or System Settings (macOS 13-14) Open Internet Accounts Select Google Enter your full Carleton email address and click Next Sign into your Carleton account as usual Select the apps you'd like to use with your Carleton account and click Done Archiving your Mail Wait for all of your email to sync to Apple Mail after configuring it in the steps above Right click on the Carleton mail box and choose the option to Export Mailbox When prompted to choose a destination folder , select your preferred folder (for example Documents), and then click Choose"
Email: Archiving your email using MailStore,https://stolafcarleton.teamdynamix.com/TDClient/2092/Carleton/KB/ArticleDet?ID=143879,"Carleton has no affiliation with the MailStore company or product. We do, however, consider it a possible option for archiving your Carleton email account when you leave campus. We have provided documentation here simply as a reference and these instructions are specific to your Carleton account. Download and Install Download the free MailStore Home software from the product's web page Before Archiving Before you begin the process of archiving your account: Ensure that you have a good internet connection : stable and fast are better Ensure that you can leave your computer on and running for several hours Configuring MailStore The following instructions will guide you through configuring MailStore Home for use in archiving your Carleton College email account. Open the MailStore Home application Click on the Archive E-mail link under the Quick Access menu Enter your Carleton email address under E-mail Account heading Click on the Advanced dropdown menu and select Gmail When prompted, enter your Carleton email address then click Authorize A new browser window or tab will open prompting you to allow Mailstore to access your Gmail account Note: If you are logged in to both your Carleton and personal Gmail accounts, you will need to select your Carleton account before seeing this page. Click on the Allow button to grant access Switch back to the MailStore Home application, where there should now be a message that says Application is authorized Click on the Test button to ensure that Mailstore can access your account. If all is well, you should receive the message Connection successfully established You will now have the option to specify a date range – if you want to archive your entire account, don't make any changes You will now get a message confirming that a new profile has been created with your Carleton account name You have now configured MailStore to access and archive your Carleton account, but it has not yet begun archiving. Begin Archiving Open the MailStore Home application Click Archive E-mail on the left hand side Double-click your Carleton account profile name The archiving process will now begin."
Email: Granting Delegate Access to Your Email Account,https://stolafcarleton.teamdynamix.com/TDClient/2092/Carleton/KB/ArticleDet?ID=152259,"On occasion, people want others to be able to read, compose, send, and delete email on their behalf. This is most common for high-level college administrators who wish their assistants to be able to manage their email. NOTE: This will grant your chosen delegate access to all your email, including the ability to read, send, and delete messages on your behalf. How to Add a Delegate to your Email Account Please follow Google's instructions for adding a delegate to your email"
Email: Mail Merge,https://stolafcarleton.teamdynamix.com/TDClient/2092/Carleton/KB/ArticleDet?ID=150190,"Carleton has licensed a general-purpose email merge program called Mail Merge With Attachments for Gmail for college use. This product is an Add-on for Google Sheets, and allows you to create a spreadsheet that it will then use as the recipients list/database to perform the mail merge. If you need a license to this tool, please submit a Software Request ticket . Setting up the Gmail/Google Sheets Add-on In your browser, go drive.carleton.edu and log in with your Carleton username and password Open a new Google Sheet (click the + New button and select Google Sheets ) In the Extensions menu, select Add-ons and then Get Add-ons Search for Mail Merge with Attachments and select it Click the large blue Install button Click Continue to consent to the install (be sure to select your @carleton.edu account) You'll see a list of the various permissions that Mail Merge needs to be granted in order to do its work. It's a long list, and you should review them. You may need to scroll down to find and click on the Allow button to continue. Note : if anything on this list makes you uncomfortable, you might choose an entirely Google-based approach . Once the installation is completed, in the Google Sheet, click on the Extensions menu Click on Mail Merge with Attachments and select Restore License The Activate Premium License dialog will open, and you will need to enter Carleton's license key. Click here to view Carleton's license key . Click the Activate button When you see the message License Activated. Please reload the sheet! , click on the reload button in your browser window Now, return to the Mail Merge with Attachments option under Extensions menu; you should see that all the options for performing your mail merge are now available. Note : Once activated with Carleton's premium license key, you may use the Mail Merge add-on to send any number of messages up to Google's own limit (currently 1,500 total messages per day)."
Email: Setting an auto-reply in Gmail,https://stolafcarleton.teamdynamix.com/TDClient/2092/Carleton/KB/ArticleDet?ID=143853,"Whether you're on vacation, leave, or planning to leave Carleton, you can set up an auto-reply in Gmail. Here are instructions from Google on how to set an auto-reply"
Email: Setting your Browser to be your Default Email Program,https://stolafcarleton.teamdynamix.com/TDClient/2092/Carleton/KB/ArticleDet?ID=155059,"If you click on a linked email address online, your computer will attempt to open your default email program and put that email address into the ""To"" line. If you use Gmail in your browser as your default email program, here's how to set things up so that those email links open in a Gmail composing screen. 1) Set your Browser to be your Default Email Application Windows In your Start menu, search for Default Apps In the Email section of the Default Apps settings page, select your preferred browser (Chrome, Firefox, Edge, etc) Mac Follow Apple's instructions (link opens in a new window) and select your preferred browser (Chrome, Firefox, Edge, etc) 2) Set your Browser to default to Gmail Chrome (click to show/hide): In Chrome, click on the 3-dot menu at the top right of your screen and select Settings Select the Privacy and Security section Click Site Settings Click on Additional permissions Click on Protocol Handlers Select Sites can ask to handle protocols (if mail.com appears on the list, make sure it's not blocked) Open gmail.carleton.edu in Chrome In the address bar, click the double-diamond Service Handler icon When prompted to Allow mail.google.com to open all email links? , select Allow and then Done . Firefox (click to show/hide): In Firefox open the 3-bar ""Hamburger"" menu at the top right of your screen and select Settings Search the preferences box for mail Beside the mailto option, click the Action column and select Gmail Safari (click to show/hide): Unfortunately Safari doesn't offer a way to make this automatic. The best course of action is: Right-click on the email address and select Copy Email Address Open Gmail and paste the email address into the To: line of a new message Edge (click to show/hide): In Edge, open the 3-dot menu at the top right of your screen and select Settings In the left-hand Settings menu, select Cookies and site permissions Select Protocol handlers Ensure that the option to Allow sites to ask to become default handlers for protocols is turn ON Open gmail.carleton.edu in Edge In the address bar, click the double-diamond Service Handler icon When prompted to Allow mail.google.com to open all email links? , select Allow and then Done . Need Help? Please contact the ITS Helpdesk for assistance: go.carleton.edu/helpdesk or 507-222-5999"
Email: Sort and Evaluate Email by File Size,https://stolafcarleton.teamdynamix.com/TDClient/2092/Carleton/KB/ArticleDet?ID=148201,Check your Google Drive storage by visiting https://drive.google.com/ settings/storage Here's a short video with more information:
"Email: Sort Email by Sender, Subject, and More",https://stolafcarleton.teamdynamix.com/TDClient/2092/Carleton/KB/ArticleDet?ID=148202,
Email: Transferring Carleton email to a personal Gmail account,https://stolafcarleton.teamdynamix.com/TDClient/2092/Carleton/KB/ArticleDet?ID=143858,"Moving email between accounts is never a straightforward process, not even when moving between Google accounts. NOTE: This process can take days or even weeks depending on the size of your email account. Prepare your Personal Account Check how much storage space your Carleton email account takes. If you scroll down to the very bottom of your inbox it'll say "" Using "" and then a number of MG (Megabytes) or GB (Gigabytes) Check your storage limit on your Personal account and make sure that there is enough space left to accommodate the amount of email stored in your Carleton account. Purchase additional storage if necessary Start your Transfer Go to takeout.google.com/transfer and log in with your Carleton account Enter your Personal account information and work through the steps that Google presents for beginning your transfer Manual Method (if needed) We recommend that you start with the Google Takeout Transfer method, which is simpler and faster. However, if you run into issues with that tool, here's how to manage your transfer manually. Create an App Specific Password for your Carleton gmail account Manually transfer your mail using POP3 Carleton Username: your full Carleton email address Carleton Password: use the App-specific password you created in Step 1 POP Server: pop.gmail.com Port: 995 Deselect ""leave a copy of retrieved message on the server"" Select ""always use a secure connection (SSL) when retrieving mail"" Select ""Label incoming messages"" with the default label Deselect ""archive incoming messages (Skip the inbox)"" Transfer will begin within 5-10 minutes Note that this method is limited by Google's bandwidth policies and will transfer approximately 38,000 messages per day."
Email: Transferring very large email accounts,https://stolafcarleton.teamdynamix.com/TDClient/2092/Carleton/KB/ArticleDet?ID=144518,"Google offers a Transfer tool that works well for most people and most email accounts. However, sometimes that tool fails, and it seems that it may fail if confronted with very large email accounts (e.g. 100GB of storage). In cases like this, you will have to rely on the options below. Transfer messages and attachments while preserving folders/labels This will be an almost entirely manual process and will have to happen slowly so as not to exceed Google's bandwidth limits (which will lock the Google account). 1) Prepare your Accounts Check how much storage space your Carleton email account takes. If you scroll down to the very bottom of your inbox it'll say "" Using "" and then a number of MG (Megabytes) or GB (Gigabytes) Check your storage limit on your Personal account and make sure that there is enough space left to accommodate the amount of email stored in your Carleton account. Purchase additional storage if necessary Turn IMAP on for BOTH of your gmail accounts Install the Thunderbird email application 2) Connect Thunderbird to both of your gmail accounts IMPORTANT : Pay attention to the options when you connect each account so that you only download the most recent messages from your very large account. Otherwise you may end up using up all the storage space on your computer, which can result in an unusable computer. In the Thunderbird application, go to the File menu and select New > Existing Mail Account Enter your name, full email address, and password, and click Continue Keep the default IMAP option (don't switch to POP3) and click Done A new window will pop up so that you can fully log into your account and allow access for Thunderbird When you get to the screen in Thunderbird that says that your account has been successfully created, click on Account Settings Click on Synchronization & Storage Under Disk Space , select the option to synchronize the most recent 30 days (you can probably increase this to 90 days, but this setting will save your computer from being overwhelmed by email messages) Repeat these steps for your other gmail account NOTE : If you have a downloaded .MBOX file of your Carleton email, you can connect that to Thunderbird instead of connecting to your live email account (instructions coming soon). Messages can be moved over to your new account in exactly the same way regardless of how you access your Carleton email. 3) Transfer messages folder by folder This is the very manual part. You will have to repeat this process for each folder/label from your Carleton account. In Thunderbird, right click on the gmail address of your destination account and select New Folder Create a new folder with the same name as one of the folders in your Carleton email account In your Carleton account within Thunderbird, select the messages from the folder in your Carleton account that you've just recreated in your new account (select up to about 5,000 messages at a time unless you have a lot of attachments, in which case select fewer) Drag the email messages into the new folder in your destination gmail account within Thunderbird Repeat the process of selecting messages from your Carleton account and dragging them to the recreated folder in your destination account until you have emptied the Carleton folder into the destination folder Repeat these steps for every folder you want to preserve/recreate in your destination account NOTE : You can only move 500MB of messages per day, and if you go over that limit Google will lock your accounts for 24 hours. There is very little way to know exactly how many MB you have moved, so a good rule of thumb for a normal inbox is to move about 20,000 messages in a day but no more. 4) Transfer remaining messages after folders are moved Once all the messages in folders have been transferred, you can move on to a more automated method that can also move more messages per day. Use the ""Manual"" method listed here to set up a POP3 transfer from your Carleton account to a destination account . This will move approximately 1250MB per day, or about 38,000 messages per day depending on the number and size of the attachments on your messages. Transfer messages and attachments only (no labels) Use the ""Manual"" method listed here to set up a POP3 transfer from your Carleton account to a destination account . This will move approximately 1250MB per day, or about 38,000 messages per day depending on the number and size of the attachments on your messages."
Google Calendar: Import .ics files (especially from Workday Learning),https://stolafcarleton.teamdynamix.com/TDClient/2092/Carleton/KB/ArticleDet?ID=148899,"Many scheduling systems allow you to ""add an event to your calendar"" but don't integrate with specific calendars (like Google Calendar). They instead download a file to your computer that has the event title and then .ics at the end. Google provides instructions on how to import .ics files into your Calendar (link opens in a new window) Workday Learning is the campus training platform, and if you click the Add to Calendar button it will download an .ics file. You can upload this according to Google's instructions in order for the event to appear on your calendar."
Google Groups: Adding a group to another group (nested groups),https://stolafcarleton.teamdynamix.com/TDClient/2092/Carleton/KB/ArticleDet?ID=154295,"Before doing this, think carefully! If people try to unsubscribe from a group that they were added to by virtue of being in another group, they will accidentally unsubscribe themselves from that nested group. This could cause problems for them if the nested group is important to their work! Nesting Google Groups Go to Google Groups in a web browser and, if prompted, sign in to your account Click on the My groups button Click on the group you want to add another group to Select Manage Members Click on Invite Members Add the email address of the group you wish to nest within this group Again, be very careful with this method of nesting groups. See the warning above."
Google Groups: Email Lists at Carleton,https://stolafcarleton.teamdynamix.com/TDClient/2092/Carleton/KB/ArticleDet?ID=142945,"Manually Managed Groups Carleton uses Google Groups to create and manage email lists. To create a group: Go to groups.google.com and log in with your Carleton email address Follow Google's instructions on creating a new Google Group Add people to your group NOTE : By default, Groups at Carleton have an email address in the form [Group Name].group@carleton.edu. For example: carlslist.group@carleton.edu. If you need to remove the .group from the email address, please submit a Group request ticket . To join an existing group: Go to groups.google.com and log in with your Carleton email address Search for groups at the top of the page, or click on All Groups on the left to browse the publicly viewable Groups at Carleton Follow Google's instructions on joining a Group To Unsubscribe from a group: Go to groups.google.com and log in with your Carleton email address Search for groups at the top of the page, or click on All Groups on the left to browse the publicly viewable Groups at Carleton Follow Google's instructions for unsubscribing from a Group Automated Groups There are several automated groups at Carleton that add people automatically to the group based on automated criteria. If you leave these groups, you will be re-added each night when the automation scripts adjust group membership. Class email lists While Moodle has very good built-in messaging functions for your course, sometimes an email list is also useful. Faculty may request an email list for courses they are teaching. To request a course email list: Log into The Hub Faculty will see a section called Faculty Information Within the Faculty Information section, select Faculty Course Resources Under Choose Course Section select the course section for which you need an email list Check the box next to Google Group Click the Update button Other automated groups If you wish to request an automated group, please submit a Group Request Ticket . For some groups, there will be two linked groups to manage membership: a group created based on some data-driven criteria (i.e. ""first year students"" or ""Declared History majors"") plus a group with the name [Group Name]-extras@carleton.edu. Ultimate group membership is then made up of a combination of the data-driven component and the -extras group membership, which then allows group owners to add members to the data-driven list as needed."
Recent Changes to Google Workspaces (formerly Google Apps for Education),https://stolafcarleton.teamdynamix.com/TDClient/2092/Carleton/KB/ArticleDet?ID=137289&SIDs=10305,"Recent Updates to Google Applications Google updates Gmail, Calendar, Chat, Drive, and other applications continuously. Here is where they announce changes: Google Workspaces Updates Use the filters and search options to see updates to products you use Google Hangouts Google has discontinued Hangouts. If you had the Hangouts Extension and got a pop-up saying to remove that extension, here's how: Open the Google Chrome browser Click the 3-dot menu in the upper right Click More Tools Click Extensions Find the Hangouts extension and click Remove For instant messaging, please use Google Chat ."
Google Drive: Quick Start Guide,https://stolafcarleton.teamdynamix.com/TDClient/2092/Carleton/KB/ArticleDet?ID=146292&SIDs=11637,"Save your own time, save storage space, and improve collaboration by managing your files effectively in Google Drive. Google Workspace at Carleton Carleton's institutional subscription to Google products. See how much Storage Space you're using Google shows you how much storage space you use. Google Drive Structure Google categorizes your files into three distinct sections, each of which behaves quite differently. Learn to recognize and choose between these sections. Google Drive File Ownership Only file owners have certain rights to a file. If the owner leaves Carleton, this can leave orphaned files. Learn to manage file ownership. Managing Your Google Drive Files (coming soon!) Tips and tricks for keeping your files organized and easily accessible when you need them. Installing Google Drive for Desktop See and manage your Google Drive files from your computer's regular file structure, just like other files on your computer. Leaving Carleton: Transferring or Archiving your Google Files Take your files with you when you leave. And be sure to Transfer Ownership on any files that need to stay behind."
Google Drive: Carleton FileKeeper (carlfilekeeper@carleton.edu),https://stolafcarleton.teamdynamix.com/TDClient/2092/Carleton/KB/ArticleDet?ID=146558&SIDs=11637,"When someone leaves Carleton, their owned Google files and folders are assigned the Carleton FileKeeper (carlfilekeeper@carleton.edu) account as an Owner. There are nearly 5 million files owned by this account. This account is scheduled to expire at the end of December 2027 - and all files owned by it will also disappear at that time. If you need to manage files or folders owned by Carleton FileKeeper, you will need to create new copies. Note, there is no way to preserve the file history when a copy is made .  Notes and comments should remain. Finding items owned by Carleton FileKeeper In the search box at the top of Google Drive, search for owner:carlfilekeeper@carleton.edu The search results will be files and folders owned by Carleton FileKeeper Reclaiming Files Owned by Carleton FileKeeper Open the file Click on File > Make a Copy – You are now the owner of the copied file.  Note that some files may need to be downloaded to claim ownership. add ""#delete"" to the original file name - this helps distinguish which file can be deleted. Click Share in both files (to compare them) & share the new copy with everyone who had access to the original file.  Or, add the file to a Shared Drive that everyone else also has access to. Back on the original share list on the ""#delete"" file, click on each person's access rights (Editor, Viewer, etc) and then select Remove Access Finally, click on your own access rights and select Remove Access You and your group now have a functional copy of the original file, including the ability to fully manage access and delete the file. Reclaiming Folders Owned by Carleton FileKeeper add ""#delete"" to the name of the folder you will replace Create a new folder to replace the original folder; consider a Shared Drive for this folder location. Right-click on the new folder and select Share (you do not have to do this if you chose to locate the folder in a Shared Drive that the same group of people has access to) Share the new folder with the same people who were associated with the original folder (as above, it will help to compare the shares of both items) Move all the contents of the original folder into the new folder (note who owns each file!) Right-click on the original folder and select Share Back on the original share list on the ""#delete"" folder, click on each person's access rights (Editor, Viewer, etc) and then select Remove Access Finally, click on your own access rights and select Remove Access You and your group now have a functional copy of the original folder, including the ability to manage access and delete the folder."
Google Drive: Find and Delete Duplicate Files and Folders,https://stolafcarleton.teamdynamix.com/TDClient/2092/Carleton/KB/ArticleDet?ID=148200&SIDs=11637,
Google Drive: Installing Google Drive for Desktop,https://stolafcarleton.teamdynamix.com/TDClient/2092/Carleton/KB/ArticleDet?ID=144940&SIDs=11637,"Many people prefer to access their Google Drive files through their computer's file structure rather than through a browser window.  In comes Google's Drive for Desktop (once called ""Drivestream"" and before that something else.. Google doesn't sit still.) This application is their answer to the Dropbox app.  An advantage of Google over Dropbox is that Google assumes that you'd like your files stored in their cloud.  It works well if you're offline (if you plan ahead) and, like Dropbox, it can sometimes hiccup with variations in Internet access. Google Drive Desktop shows two of the three sections available to you in Google Drive - My Drive and Shared Drives. Shared with me is only visible on the web version. Details about each section are available here (link opens in a new tab). It is usually best if you follow the manufacturer's instructions for download & install: Download Google Drive for Desktop Google's instructions on how to install Google Drive for Desktop"
