Article_Name,Article_Link,Article_Text
Standard Computing Equipment for Carleton Employees,https://stolafcarleton.teamdynamix.com/TDClient/2092/Carleton/KB/ArticleDet?ID=136901,"In this guide: Computers Current Year Older Peripherals Monitors Other Computers Beginning in 2021, when Carleton employees receive new computers they will be issued laptops rather than desktops unless the employee specifically requests a desktop computer. Laptops will come with docks/stands, external monitors, keyboards, etc so that employees have sufficient screen real estate while working at their desks and better options for ergonomic working conditions 2023-2024 Computers Apple MacBook Pro 13-inch macOS Ventura Apple M2 chip with 8-core CPU, 8-core GPU, and 16-core Neural Engine 16GB SDRAM 512GB/1TB SSD 3yr AppleCare+ Protection iMac desktop (by request) Apple M1 chip 16GB RAM 512GB SSD Windows Microsoft Surface Laptop 5 Windows 11 Enterprise Intel Core i7-1185G7 Processor (3.0GHz, 4 cores, 12MB Cache) 13.5"" (2256 x1504) Touchscreen Display 16GB RAM 512GB SSD 3yr Microsoft Service Agreement Dell OptiPlex 7000 (by request) Windows 11 Enterprise Intel Core i7-12700 16GB RAM 512GB SSD 4yr Microsoft Service Agreement Older standard computers ITS staff, please see our list of older standard computers Perip herals Peripherals such as monitors, keyboard, and laptop stands are replaced as needed. Monitors The standard policy is that each employee gets two ""screens"" included in their standard setup. This will be either a laptop (or iMac desktop) with 1 external monitor; or a screen-less desktop (e.g. Dell mini-tower) with 2 external monitors. If additional monitors are needed, please place a Hardware Request and provide a budget code that we can charge for additional equipment. Note the monitors listed below may not be the exact models currently available, but should be comparable to available monitors. ITS may also deploy used monitors, but if so, those monitors will be of comparable quality and working condition. Dell UltraSharp 24"" Monitor - U2422H Resolution: 1920 x 1080 Brightness: 250 cd/m² Adjustable height, orientation, left/right tilt, and up/down tilt Lenovo ThinkVision 23.8"" Monitor - S24e-20 Resolution: 1920 x 1080 Brightness: 250 cd/m² Adjustable up/down tilt Laptop Docks/Stands Griffin Elevator Laptop Stand Lenovo ThinkPad Ultra Dock for Lenovo laptops Mouse options Apple wireless Magic Mouse Apple wired Magic Mouse (limited to existing stock, no longer sold by Apple) Microsoft wireless Sculpt Comfort Mouse Microsoft/Dell/Logitech wired mouse Keyboard options Apple wired keyboard with numeric keypad (limited to existing stock, no longer sold by Apple) Apple wireless Magic Keyboard Dell/Logitech wired keyboard Logitech MK270 Wireless Keyboard and Mouse Combo Optional Changes/Additions Available Many options are available to meet your needs. Typically ITS will charge your budget number for the cost of additional/custom equipment. Place a Hardware Request and provide a budget code that we can use to charge for additional/custom equipment."
Windows: New Computer Setup,https://stolafcarleton.teamdynamix.com/TDClient/2092/Carleton/KB/ArticleDet?ID=137536,"So, you've gotten a new computer from us! Here are your next steps. Teaching the laptop your username Connect your laptop to power and data Before continuing with the set-up process, connect your laptop to power and to the wired campus network: Plug the long end of the USB-C hub we supplied into a USB-C port on your laptop (this hub was specifically configured to work with your computer) Plug your computer's power cord into the wall and then connect it to the charging port on your laptop Plug an ethernet cable into the USB-C hub (make sure the other end comes from the back of your phone, if you have one, or an ethernet port in the wall) Initial Login There are a few steps necessary to make sure the computer will ‘remember’ your account even after you unplug its ethernet connection. (while plugged into ethernet) Log into your account, and log out (while still plugged into ethernet) Log into your account, and log out again Unplug the ethernet cable, and log in again As long as you are able to log in fine the third time, the computer should ‘remember’ your account fine, even without an internet connection. Set up core applications and settings Select a Patching Schedule Change your admin password Set up BitLocker Configure Eduroam WiFi Set up the GlobalProtect VPN Manage your Cloud Backup Transfer data from your old computer using either Replace Device or Restore Files Set up Printers Set up core applications Microsoft Office (this should already be installed, but can be downloaded if needed ) The first time you use an MS Office application (Word, PowerPoint, etc) you will be asked to log in using your Carleton email address Dropbox Google Drive for Desktop (formerly Google File Stream) Adobe Creative Cloud Zoom Other software as needed! You can install software using your .\admin password. The Helpdesk is also happy to help. Quick link to information about Carleton faculty & staff computers: https://bit.ly/new-carleton-computer"
macOS: Canon Printing Setting Presets,https://stolafcarleton.teamdynamix.com/TDClient/2092/Carleton/KB/ArticleDet?ID=140466,"Open the print menu by clicking the print icon or File, Print on something you'd like to print. If you are printing from a web browser (Google Chrome, Safari, Firefox, etc.): Click the ""Print using system dialog"" button If you are using a Microsoft Office program, look for the “show details” button Alternatively, you may be able to advance straight to the next step. This is frequently the case for Microsoft Word For Canon printers, 1-sided (simplex) and 2-sided (duplex) printing settings are underneath the "" Finishing "" section. Color and grayscale printing settings are underneath the "" Quality "" section. PowerPoints are an exception to this and the setting is in the PowerPoint section. Click the ""Presets"" drop down menu and select ""Save Current Settings as  Preset"" You can also view current presets and the associated settings by clicking ""Show Presets"" Enter a clear name for the preset. If you want this preset to apply for all printers that you have added to your computer, then make sure ""All printers"" is selected Your new preset should be created and ready for future use! Enabling Stapler Printing Option If you need to enable stapling onto your print job, follow these instructions: macOS: Enabling Stapler and Other Specialty Printing Options"
macOS: Enabling Stapler and Other Specialty Printing Options for Canon Printers,https://stolafcarleton.teamdynamix.com/TDClient/2092/Carleton/KB/ArticleDet?ID=140518,"Go to the Apple Menu and select System Preferences (macOS 11-12 ) or System Settings (macOS 13-14) Select Printers & Scanners Select the Printer you want to be able to do specialty printing on Click the Options & Supplies button Click the Options tab Set the following options Paper Source Options: Casset Feeding Unit AM1 Paper Deck Unit: Off Output Options: Inner Finisher H1 Copy Tray: Off Puncher: None Check the box next to Secure Printing Function of Device Click OK Other Printing Options for Cannon Printers If you need to set other presets such as simplex/duplex printing or color-scale/gray-scale, follow these instructions: macOS: Canon Printing Setting Presets"
macOS: Xerox Printing Setting Presets,https://stolafcarleton.teamdynamix.com/TDClient/2092/Carleton/KB/ArticleDet?ID=141749,"If you do not see the options in the instructions below, open the Self Service application on your computer and either install or reinstall the Xerox drivers and then remove and re-add the specific printer . Go to System Preferences (macOS 11-12 ) or System Settings (macOS 13) > Printers and Scanners and select your printer Select your printer, then Options and Supplies and then the Options Button.  Set Duplex Module to Installed Open the print menu by clicking the print icon or File, Print on something you'd like to print. If you are printing from a web browser (Google Chrome, Safari, Firefox, etc.): Click the Print using system dialog button If you are using a Microsoft Office program, look for the show details button Alternatively, you may be able to advance straight to the next step. This is frequently the case for Microsoft Word When you print a document, you can find 1-sided (simplex) and 2-sided (duplex) and Color and grayscale under the Xerox Features menu of the print dialog box Click the Presets drop down menu and select Save Current Settings as Preset You can also view current presets and the associated settings by clicking Show Presets Enter a clear name for the preset. If you want this preset to apply for all printers that you have added to your computer, then make sure All printers is selected Your new preset should be created and ready for future use!"
Windows: Changing Default Printing Settings,https://stolafcarleton.teamdynamix.com/TDClient/2092/Carleton/KB/ArticleDet?ID=140465,"At Carleton, each printer already has default settings set up. You can check print.ads.carleton.edu/printers/ (must be on campus or on the VPN to view) where the printer defaults are listed under Comment, where it says Add-ons . Default settings are listed with the format “default-duplex” or “default-grayscale."" Click the windows icon in the bottom left corner of your screen and begin typing "" Control Panel "" Click on Devices and Printers Right-click on the printer and choose Printing preferences You’ll see various tabs of options that vary depending on the type of printer. Most settings regarding one-sided/double-sided and color/gray-scale printing, and paper size are under a tab named something like “Printer Options” , “Image Options” or ""Paper/Quality"" When done, click “Ok” to apply and close the window Note: these new settings will be applied every time you print with this printer until they are changed again. These settings won’t be applied to any other printer, you’ll have to repeat these steps for any other printers"
Xerox: Secured Printing,https://stolafcarleton.teamdynamix.com/TDClient/2092/Carleton/KB/ArticleDet?ID=146879,"What is Secured Printing? On most Xerox printers, it is possible to send a confidential, ""secure print"" job, to use the industry term. A secure print job is held at the device until you arrive to release it, entering the PIN number you put in when you created the job. This is useful for documents that you don't want others to see, or for large documents that you don't want to hog the printer until you can arrive to babysit. Whether you can use Secure Print with a particular Xerox printer depends on the model of the printer (usually, whether it has a hard drive or RAM drive in it, and up-to-date firmware), and the printer driver (and operating system) on the computer from which you are sending the print job. (Printing must be done directly from a client computer; WebPrint will not work.) Windows client computers always use the Xerox Global Print Driver (X-GPD) PostScript installed from the print server. Mac client computers install printer drivers via the Jamf Self-Service (link opens in a new tab) . Here is an idea of which Xerox models might support Secure Print on each platform, but check your specific printer to be sure Supported on Windows: -X3600, -X3610 (Phaser), -X7760 (Phaser), -XC600 (VersaLink) Not Supported on Windows: -X5550 (Phaser), -X7500 (Phaser) Secured Printing on Windows In your Windows application, choose to Print. Depending on the application, select a button named ""Print Options"" or ""Preferences"". Choose a Print Setup or Printer Properties button only if you don't see either of the others. You're now seeing the Xerox Global Print Driver (X-GPD), Postscript, printer driver. On the Printing Options tab, change the Job Type to Secure Print... A Secure Print window will pop up asking you for a 1-12 digit Passcode (PIN) for this document. (By default, it contains the last passcode you used with a Xerox printer.) Enter any number you wish (4 digits is nice), and enter it again to confirm, but you must remember it; you won't be able to print the document without it. Leave the Job Name field set to ""Use Document Name"", or else you won't be able to identify this document, and choose OK. Change any other options in the printer driver you want, then choose the OK button to close the driver, then choose the Print button in your application. Secured Printing on Mac Note: You might need to install the latest version of the Mac OS X printer driver for this model for these features to work. In your application, choose the Print option. Select Print using the system dialog Click Layout and switch it to Xerox Features Change Job Type from Normal Print to Secure Print Enter a PIN - make sure you remember this, you will need it to print at the printer. Click Print Releasing a Secured Print Job at the Printer On the printer LCD console panel: On a Phaser 3600 or 3610 , press the Menu button (or Left arrow button?), then the up/down arrows to Walk-Up Features then press OK, then up/down arrows to Secure Print then press OK. On a Phaser 7760 , select Walk-Up Printing then press OK, then select Secure Print Jobs , then press OK. On a VersaLink C600 , press the Home button, then on the LCD console choose Jobs , then Personal & Secure Jobs . Navigate to your username then press OK. Use the numeric keypad or the arrow keys to enter your passcode (PIN) then press OK. Select the desired job then use the arrow keys to select options (Print, or Delete after Print) and answer prompts, then press OK. After the job prints, press the physical Start/Stop or Cancel buttons to return the printer to Ready mode."
Classroom Technology,https://stolafcarleton.teamdynamix.com/TDClient/2092/Carleton/KB/ArticleDet?ID=142282,The Classroom Technology Support team provides detailed information about each classroom and the technology available in that classroom on their Classroom Technology Support site .
Language Lesson: Report an Issue,https://stolafcarleton.teamdynamix.com/TDClient/2092/Carleton/KB/ArticleDet?ID=140434,"To report an issue about Language Lesson, click here ."
Language Lesson: Student Tutorial,https://stolafcarleton.teamdynamix.com/TDClient/2092/Carleton/KB/ArticleDet?ID=140430,Below is a link short video tutorial for students on how to use Language Lesson version 3 (Winter 2022). Student Tutorial
Leaving Carleton - Your Personal/Class Websites,https://stolafcarleton.teamdynamix.com/TDClient/2092/Carleton/KB/ArticleDet?ID=143255,"Table of Contents Overview Your Options Moving to Another Hosting Provider Passing the Baton Archiving Your Website Permanent Deletion Next Steps Overview If you have ever edited a website with “ sites.carleton.edu ” in the url, chances are you own or were a part of a website in CarlSites (Carleton’s Academic Website service). Before you lose access to your Carleton account, make sure you have a plan for your content before you leave. For students , the College can continue to host your website(s) in our platform for up to 2 years , but we can start the process for the options below right away. For faculty and staff , we will only host your website(s) in our platform during your employment period with the College. If we do not receive a response by the end of these holding periods, your content will be permanently deleted. Your Options Moving to Another Hosting Provider If you own a website or domain and would like to continue working on it beyond graduation, you’ll want to capture a copy of your site(s) then move it to another server. You can chose to move your domain to Reclaim Hosting (Carleton's hosting provider for CarlSites) with a student discount or another web hosting service of your liking. To start this process, please email at@carleton.edu and obtain a copy of your content. Please note : The College will not bear any expenses associated with this migration. Your Carleton account access will still expire after graduation (end of July). So if you choose to keep your site past your account expiration date, please provide us with an alternate email address , such as a personal gmail account. Passing the Baton If you built a personal or communal website, affiliated with a specific department, program or office, and you would like to keep the site at Carleton, please find a consenting member of our Carleton community (preferably a relevant staff or faculty member) to take ownership of the website. Please note: The designated member must take ownership of the site before your Carleton account access expires.You can still have access to the site (provided we have an alternate email address on file), but the designated member will be the new owner. If you choose to remove the site while under new ownership, you are responsible for communicating with and obtaining written permission from the new owner before the site can be completely removed. Archiving Your Website If you wish to preserve your website and not make additional changes, we can help you archive your site. Archiving a website means obtaining a copied version of your website (with its content, data, and media) and storing that copy elsewhere. We can help you archive your website and obtain the necessary files to host it in a local and/or public location. Permanent Deletion We understand that you may not want to keep everything you create at Carleton and would rather have it removed. For these cases, we can permanently remove your website along with all of its contents. Please note : After this removal, the College will not be responsible for providing any copies or backups of your data. Next Steps Please contact Academic Technology (at@carleton.edu) regarding your decision or if you have any questions about the options above. Acknowledgement Created by Em Palencia, 5/12/22, updated 5/26/23"
"FlexWork: Communication, Calendars, and Setting Shared Expectations",https://stolafcarleton.teamdynamix.com/TDClient/2092/Carleton/KB/ArticleDet?ID=137230,"Many Carleton Faculty and Staff are used to determining availability by looking for a person at their office or workstation. Not only will colleagues not necessarily be working from their desk, but if the colleague is at a desk they may actually be in a meeting or otherwise not available for interruption. Here are some ways to set and check people's availability for hybrid and remote teams. Develop Shared Expectations with Your Team There are lots of communication tools and settings available , so make sure that you and your team have a shared understanding on things like: How you'll signal to each other that you're busy vs. interruptable What types of communication work best for your team over email, phone, chat, zoom, etc. Will you use Chat or the phone for quick/immediate things while using email for things that have longer timeframes? Are there times when you'll need to rely on asynchronous communication (such as email) as opposed to synchronous communication (such as phone or zoom conversations)? Are there things that should happen over email so that there's a record of the communication? Are there things that should happen by phone or with Chat history turned off so that there's no data retained from the conversation? How will you distinguish between routine vs urgent communications How will you acknowledge that you've received messages when you don't have time to respond fully right away Remember that just like in the physical office, there are many reasons why a colleague may not be at their computer or available to talk at a given moment. Shared expectations will help foster healthy communication rhythms for hybrid and remote teams. Calendar Tips Calendars are powerful communication tools! At a minimum, they can signal to your colleagues when you are unavailable for other conversation. You can set up your Calendar to list your default work hours and location so that colleagues are alerted if they try to invite you to an event outside of your work hours You can use built-in RSVP options in Google Calendar to indicate whether you'll attend the event in person or remotely Event hosts, include a remote option whenever possible, and if attendees respond that they will attend remotely when there is no remote option, communicate with them about their needs and any available options for the meeting. Consider developing a standard way of naming Calendar events so that all attendees know whether an event is on site, hybrid, or virtual. Everyone at Carleton can see your free/busy time (but no event details unless your events or your calendar have been designated Public), so you can check a colleague's calendar to see whether it indicates that they are busy You can manage the visibility of individual events that you created You can share your calendar details with other people who need to see more about what you're doing When you're out of the office, let your calendar help you manage event invitations (scroll down on that page to the Out of Office options) You can integrate Zoom and your Calendar by installing a free plugin Setting your Availability Status Availability statuses help your colleagues know whether they can reach you. In Google Chat and Gmail you can set your availability status , including custom statuses that you determine Not available for a phone all? Set your phone extension to Do Not Disturb Out of Office Notifications When you're unavailable, help your colleagues know that you won't be responding quickly: let your calendar help you manage event invitations (scroll down on that page to the Out of Office options) set up an Out of Office email responder Set a temporary voicemail greeting on Zulu or your Grandstream phone to alert people that you may be delayed in answering voicemail messages Send a Quick Message There's nothing like a quick ""Are you available to chat for a second?"" message sent in Google Chat or email, depending on what your colleagues use as their preferred immediate communication method. Some people may look available because they're sitting quietly at their desk, but they're actually in a meeting or otherwise not interruptable."
Preparing to Work from Off Campus,https://stolafcarleton.teamdynamix.com/TDClient/2092/Carleton/KB/ArticleDet?ID=137075,"There are many reasons for working from off campus. You may be a hybrid or remote work employee, or you may simply be in an airport or coffee shop. Whatever the reason, here are some preparations to make so that your technology functions for you while you're off campus. Before You Work Off Campus Make sure you have the VPN installed and functioning properly Back up your computer's files Store any files you'll need to use in the Cloud for easy access and continuous backup Know about your Internet connection Write down your Internet Service Provider's name and phone number, as well as your account number, in case of Internet outages Consider your computer equipment Request a Zulu Softphone account Talk with your team about communication patterns Need Help? Please contact the ITS Helpdesk for assistance: go.carleton.edu/helpdesk or 507-222-5999"
