Article_Name,Link,Category_Under
GlobalProtect VPN: Installing and Connecting Your Carleton VPN,https://stolafcarleton.teamdynamix.com/TDClient/2092/Carleton/KB/ArticleDet?ID=137157,Accounts & Passwords
Logging into Carleton systems: Quick Start Guide,https://stolafcarleton.teamdynamix.com/TDClient/2092/Carleton/KB/ArticleDet?ID=142960,Accounts & Passwords
Windows Admin Accounts: Setting/Changing your local account on your Carleton Windows computer,https://stolafcarleton.teamdynamix.com/TDClient/2092/Carleton/KB/ArticleDet?ID=136957,Accounts & Passwords
Alumni Accounts and Passwords,https://stolafcarleton.teamdynamix.com/TDClient/2092/Carleton/KB/ArticleDet?ID=136813,Accounts & Passwords
Alumni and Guest Logins: Logging into Carleton Services Using a Non-Carleton Account,https://stolafcarleton.teamdynamix.com/TDClient/2092/Carleton/KB/ArticleDet?ID=142918,Accounts & Passwords
Alumni Handshake Accounts,https://stolafcarleton.teamdynamix.com/TDClient/2092/Carleton/KB/ArticleDet?ID=136812,Accounts & Passwords
"GlobalProtect VPN: Troubleshooting ""Stale Request"" at login",https://stolafcarleton.teamdynamix.com/TDClient/2092/Carleton/KB/ArticleDet?ID=141984,Accounts & Passwords
GlobalProtect VPN: Uninstalling the VPN,https://stolafcarleton.teamdynamix.com/TDClient/2092/Carleton/KB/ArticleDet?ID=138489,Accounts & Passwords
Logging into Carleton Systems with Single Sign On,https://stolafcarleton.teamdynamix.com/TDClient/2092/Carleton/KB/ArticleDet?ID=142976,Accounts & Passwords
Parent Accounts,https://stolafcarleton.teamdynamix.com/TDClient/2092/Carleton/KB/ArticleDet?ID=142962,Accounts & Passwords
Password Managers: Recommendations,https://stolafcarleton.teamdynamix.com/TDClient/2092/Carleton/KB/ArticleDet?ID=137726,Accounts & Passwords
Password Recovery Options Setup,https://stolafcarleton.teamdynamix.com/TDClient/2092/Carleton/KB/ArticleDet?ID=146212,Accounts & Passwords
Proxy Accounts: Set-up Instructions,https://stolafcarleton.teamdynamix.com/TDClient/2092/Carleton/KB/ArticleDet?ID=137579,Accounts & Passwords
Proxy Accounts: Sign-in Instructions,https://stolafcarleton.teamdynamix.com/TDClient/2092/Carleton/KB/ArticleDet?ID=137580,Accounts & Passwords
Proxy Accounts: Updating your Information,https://stolafcarleton.teamdynamix.com/TDClient/2092/Carleton/KB/ArticleDet?ID=147092,Accounts & Passwords
YouTube Premium and YouTube Music Premium accounts,https://stolafcarleton.teamdynamix.com/TDClient/2092/Carleton/KB/ArticleDet?ID=154164,Accounts & Passwords
Faxing With FreePBX,https://stolafcarleton.teamdynamix.com/TDClient/2092/Carleton/KB/ArticleDet?ID=140095,Communication & Collaboration
Instructions on how to use the Jabra Speak,https://stolafcarleton.teamdynamix.com/TDClient/2092/Carleton/KB/ArticleDet?ID=139058,Communication & Collaboration
Scanning on Canon Multifunction Devices (MFDs),https://stolafcarleton.teamdynamix.com/TDClient/2092/Carleton/KB/ArticleDet?ID=145032,Communication & Collaboration
Logitech Headset Introduction,https://stolafcarleton.teamdynamix.com/TDClient/2092/Carleton/KB/ArticleDet?ID=111500,Communication & Collaboration
ArcGIS: Copying Files to another ArcGIS Online Account,https://stolafcarleton.teamdynamix.com/TDClient/2092/Carleton/KB/ArticleDet?ID=143878,Digital Storage
Amazon: Purchasing Restricted Items,https://stolafcarleton.teamdynamix.com/TDClient/2092/Carleton/KB/ArticleDet?ID=143123,Hardware & Software
CDW: Carleton's Computer Purchasing Portal,https://stolafcarleton.teamdynamix.com/TDClient/2092/Carleton/KB/ArticleDet?ID=145388,Hardware & Software
Clearing Your Browser's Cache and Cookies,https://stolafcarleton.teamdynamix.com/TDClient/2092/Carleton/KB/ArticleDet?ID=137761,Hardware & Software
"HEIC, HEIF, and HEVC image and video files",https://stolafcarleton.teamdynamix.com/TDClient/2092/Carleton/KB/ArticleDet?ID=150142,Hardware & Software
Opening Private/Incognito Browsing Windows,https://stolafcarleton.teamdynamix.com/TDClient/2092/Carleton/KB/ArticleDet?ID=140607,Hardware & Software
Purchasing a Personal Computer: Advice and Resources,https://stolafcarleton.teamdynamix.com/TDClient/2092/Carleton/KB/ArticleDet?ID=137623,Hardware & Software
Troubleshooting: GlobalProtect VPN login issues,https://stolafcarleton.teamdynamix.com/TDClient/2092/Carleton/KB/ArticleDet?ID=138492,Hardware & Software
"Troubleshooting: Google Chrome's messages that ""Your organization will manage this profile""",https://stolafcarleton.teamdynamix.com/TDClient/2092/Carleton/KB/ArticleDet?ID=143948,Hardware & Software
Troubleshooting: MacOS Blocked Extensions,https://stolafcarleton.teamdynamix.com/TDClient/2092/Carleton/KB/ArticleDet?ID=136387,Hardware & Software
Troubleshooting: OnBase Scrolling Issue,https://stolafcarleton.teamdynamix.com/TDClient/2092/Carleton/KB/ArticleDet?ID=139044,Hardware & Software
Windows: Troubleshooting dropped Ethernet or Monitor connections on Surface Laptops with USB Hub adapters,https://stolafcarleton.teamdynamix.com/TDClient/2092/Carleton/KB/ArticleDet?ID=140647,Hardware & Software
GlobalProtect VPN: Installing and Connecting Your Carleton VPN,https://stolafcarleton.teamdynamix.com/TDClient/2092/Carleton/KB/ArticleDet?ID=137157&SIDs=10310,Information Security
Malwarebytes: Installation and setup,https://stolafcarleton.teamdynamix.com/TDClient/2092/Carleton/KB/ArticleDet?ID=141949&SIDs=10866,Information Security
Report Suspicious Email,https://stolafcarleton.teamdynamix.com/TDClient/2092/Carleton/KB/ArticleDet?ID=118955,Information Security
Top Security Practices for Students,https://stolafcarleton.teamdynamix.com/TDClient/2092/Carleton/KB/ArticleDet?ID=137387,Information Security
Connecting to the Internet at Carleton: Quick Start Guide,https://stolafcarleton.teamdynamix.com/TDClient/2092/Carleton/KB/ArticleDet?ID=137482,Internet & Networks
Eduroam: Connecting to Wireless Internet at Carleton,https://stolafcarleton.teamdynamix.com/TDClient/2092/Carleton/KB/ArticleDet?ID=136843,Internet & Networks
The Carleton Guest Wifi Network: Getting Connected,https://stolafcarleton.teamdynamix.com/TDClient/2092/Carleton/KB/ArticleDet?ID=136955,Internet & Networks
Eduroam for Android: Getting connected,https://stolafcarleton.teamdynamix.com/TDClient/2092/Carleton/KB/ArticleDet?ID=136908,Internet & Networks
Eduroam for Android: Troubleshooting inability to install or connect with Eduroam,https://stolafcarleton.teamdynamix.com/TDClient/2092/Carleton/KB/ArticleDet?ID=141815,Internet & Networks
Eduroam for Apple computers: Getting connected,https://stolafcarleton.teamdynamix.com/TDClient/2092/Carleton/KB/ArticleDet?ID=136913,Internet & Networks
Eduroam for Apple Watch: Getting Connected,https://stolafcarleton.teamdynamix.com/TDClient/2092/Carleton/KB/ArticleDet?ID=141201,Internet & Networks
Eduroam for iOS (iPhone or iPad): Getting connected,https://stolafcarleton.teamdynamix.com/TDClient/2092/Carleton/KB/ArticleDet?ID=136911,Internet & Networks
Eduroam for iOS: Troubleshooting inability to install or connect with Eduroam,https://stolafcarleton.teamdynamix.com/TDClient/2092/Carleton/KB/ArticleDet?ID=141811,Internet & Networks
Eduroam for Linux: Getting connected,https://stolafcarleton.teamdynamix.com/TDClient/2092/Carleton/KB/ArticleDet?ID=137682,Internet & Networks
Eduroam for macOS: Troubleshooting inability to install or connect with Eduroam,https://stolafcarleton.teamdynamix.com/TDClient/2092/Carleton/KB/ArticleDet?ID=141812,Internet & Networks
Eduroam for Windows: Getting connected,https://stolafcarleton.teamdynamix.com/TDClient/2092/Carleton/KB/ArticleDet?ID=136914,Internet & Networks
Eduroam for Windows: Troubleshooting inability to install or connect with Eduroam,https://stolafcarleton.teamdynamix.com/TDClient/2092/Carleton/KB/ArticleDet?ID=141813,Internet & Networks
Eduroam Manual Setup,https://stolafcarleton.teamdynamix.com/TDClient/2092/Carleton/KB/ArticleDet?ID=138543,Internet & Networks
Finding your Device’s MAC Address,https://stolafcarleton.teamdynamix.com/TDClient/2092/Carleton/KB/ArticleDet?ID=136857,Internet & Networks
Finding your IP address,https://stolafcarleton.teamdynamix.com/TDClient/2092/Carleton/KB/ArticleDet?ID=150396,Internet & Networks
Forget or Remove a Network,https://stolafcarleton.teamdynamix.com/TDClient/2092/Carleton/KB/ArticleDet?ID=140897,Internet & Networks
Hotspots: Finding a Jetpack's Hotspot's SSID and Password (Non-touchscreen version),https://stolafcarleton.teamdynamix.com/TDClient/2092/Carleton/KB/ArticleDet?ID=152516,Internet & Networks
Hotspots: Finding a Mi-Fi Hotspot's SSID and Password (Touchscreen version),https://stolafcarleton.teamdynamix.com/TDClient/2092/Carleton/KB/ArticleDet?ID=152489,Internet & Networks
macOS: Collecting network diagnostic information,https://stolafcarleton.teamdynamix.com/TDClient/2092/Carleton/KB/ArticleDet?ID=141932,Internet & Networks
ReMarkable Tablets and Carleton's WiFi,https://stolafcarleton.teamdynamix.com/TDClient/2092/Carleton/KB/ArticleDet?ID=151185,Internet & Networks
Reporting network problems,https://stolafcarleton.teamdynamix.com/TDClient/2092/Carleton/KB/ArticleDet?ID=141934,Internet & Networks
Troubleshooting inability to install or connect with Eduroam,https://stolafcarleton.teamdynamix.com/TDClient/2092/Carleton/KB/ArticleDet?ID=141816,Internet & Networks
Troubleshooting newer Android devices can't add Eduroam (Fall 2023),https://stolafcarleton.teamdynamix.com/TDClient/2092/Carleton/KB/ArticleDet?ID=154066,Internet & Networks
WiFi in Campus Housing,https://stolafcarleton.teamdynamix.com/TDClient/2092/Carleton/KB/ArticleDet?ID=137651,Internet & Networks
WiFi: Connecting Smart Devices,https://stolafcarleton.teamdynamix.com/TDClient/2092/Carleton/KB/ArticleDet?ID=136854,Internet & Networks
Windows: Collecting network diagnostic information,https://stolafcarleton.teamdynamix.com/TDClient/2092/Carleton/KB/ArticleDet?ID=141933,Internet & Networks
Wired (Ethernet) Internet: Port Activation,https://stolafcarleton.teamdynamix.com/TDClient/2092/Carleton/KB/ArticleDet?ID=137481,Internet & Networks
Wired (Ethernet): Registering your Device (especially for campus housing),https://stolafcarleton.teamdynamix.com/TDClient/2092/Carleton/KB/ArticleDet?ID=136852,Internet & Networks
Eduroam for ChromeOS: Getting connected,https://stolafcarleton.teamdynamix.com/TDClient/2092/Carleton/KB/ArticleDet?ID=136849,Internet & Networks
WiFi: Connecting Wifi Devices That Have No Browsers,https://stolafcarleton.teamdynamix.com/TDClient/2092/Carleton/KB/ArticleDet?ID=136853,Internet & Networks
Eduroam for visitors from other eduroam schools,https://stolafcarleton.teamdynamix.com/TDClient/2092/Carleton/KB/ArticleDet?ID=141435,Internet & Networks
Printing: Quick Start Guide,https://stolafcarleton.teamdynamix.com/TDClient/2092/Carleton/KB/ArticleDet?ID=137286,Printing
Mac: Adding a Printer,https://stolafcarleton.teamdynamix.com/TDClient/2092/Carleton/KB/ArticleDet?ID=136578,Printing
Mac: Adding Printer Drivers,https://stolafcarleton.teamdynamix.com/TDClient/2092/Carleton/KB/ArticleDet?ID=136574,Printing
Mac: Removing a Printer,https://stolafcarleton.teamdynamix.com/TDClient/2092/Carleton/KB/ArticleDet?ID=142370,Printing
Mac: Troubleshooting printing issues after upgrading to macOS 12 Monterey,https://stolafcarleton.teamdynamix.com/TDClient/2092/Carleton/KB/ArticleDet?ID=142371,Printing
"Ordering supplies (paper, toner, staples, etc) for a printer",https://stolafcarleton.teamdynamix.com/TDClient/2092/Carleton/KB/ArticleDet?ID=146136,Printing
Printing: Copying,https://stolafcarleton.teamdynamix.com/TDClient/2092/Carleton/KB/ArticleDet?ID=140617,Printing
Printing: Instructions for Faculty/Staff Computers,https://stolafcarleton.teamdynamix.com/TDClient/2092/Carleton/KB/ArticleDet?ID=137293,Printing
Printing: Instructions for Guests,https://stolafcarleton.teamdynamix.com/TDClient/2092/Carleton/KB/ArticleDet?ID=140564,Printing
Printing: Instructions for Lab or Shared-Use Computers,https://stolafcarleton.teamdynamix.com/TDClient/2092/Carleton/KB/ArticleDet?ID=137291,Printing
Printing: PaperCut Client Installation & Set-up,https://stolafcarleton.teamdynamix.com/TDClient/2092/Carleton/KB/ArticleDet?ID=137290,Printing
Printing: Troubleshooting Printing Issues,https://stolafcarleton.teamdynamix.com/TDClient/2092/Carleton/KB/ArticleDet?ID=144953,Printing
Student Printing: Managing your Print Quota,https://stolafcarleton.teamdynamix.com/TDClient/2092/Carleton/KB/ArticleDet?ID=137288,Printing
Webprint: Printing from a Personal Computer,https://stolafcarleton.teamdynamix.com/TDClient/2092/Carleton/KB/ArticleDet?ID=137292,Printing
Windows: Adding a Printer,https://stolafcarleton.teamdynamix.com/TDClient/2092/Carleton/KB/ArticleDet?ID=139261,Printing
Windows: Adding a Printer for All Users,https://stolafcarleton.teamdynamix.com/TDClient/2092/Carleton/KB/ArticleDet?ID=142427,Printing
Windows: Adding Printer Drivers,https://stolafcarleton.teamdynamix.com/TDClient/2092/Carleton/KB/ArticleDet?ID=144949,Printing
Explain Everything: Installation & Setup,https://stolafcarleton.teamdynamix.com/TDClient/2092/Carleton/KB/ArticleDet?ID=153106&SIDs=12103,"Technology for Teaching, Learning and Research"
Google Groups: Email Lists at Carleton,https://stolafcarleton.teamdynamix.com/TDClient/2092/Carleton/KB/ArticleDet?ID=142945&SIDs=10982,"Technology for Teaching, Learning and Research"
Mounting the COURSES or PROTECTED Network Drive,https://stolafcarleton.teamdynamix.com/TDClient/2092/Carleton/KB/ArticleDet?ID=148546,"Technology for Teaching, Learning and Research"
Shared Course Folders,https://stolafcarleton.teamdynamix.com/TDClient/2092/Carleton/KB/ArticleDet?ID=142947,"Technology for Teaching, Learning and Research"
Campus Television Channels,https://stolafcarleton.teamdynamix.com/TDClient/2092/Carleton/KB/ArticleDet?ID=142221,You and Carleton Technology
Guide to non-ITS Digital Resources,https://stolafcarleton.teamdynamix.com/TDClient/2092/Carleton/KB/ArticleDet?ID=137479,You and Carleton Technology
ITS Helpdesk Drop-Off Center,https://stolafcarleton.teamdynamix.com/TDClient/2092/Carleton/KB/ArticleDet?ID=137638,You and Carleton Technology
TVs in Faculty & Staff Campus Housing,https://stolafcarleton.teamdynamix.com/TDClient/2092/Carleton/KB/ArticleDet?ID=146185,You and Carleton Technology
Duo: Quick Start Guide,https://stolafcarleton.teamdynamix.com/TDClient/2092/Carleton/KB/ArticleDet?ID=137061,Duo Two-Factor Authentication
Duo & GlobalProtect: Troubleshooting Blank Login Screens and Cookie access,https://stolafcarleton.teamdynamix.com/TDClient/2092/Carleton/KB/ArticleDet?ID=138502,Duo Two-Factor Authentication
Duo Passcodes: Using Passcodes Without Wifi or Cell Data,https://stolafcarleton.teamdynamix.com/TDClient/2092/Carleton/KB/ArticleDet?ID=137070,Duo Two-Factor Authentication
Duo Setup: Duo Token (Key Fob),https://stolafcarleton.teamdynamix.com/TDClient/2092/Carleton/KB/ArticleDet?ID=137064,Duo Two-Factor Authentication
Duo Setup: Landline,https://stolafcarleton.teamdynamix.com/TDClient/2092/Carleton/KB/ArticleDet?ID=137065,Duo Two-Factor Authentication
Duo Setup: Smartphone,https://stolafcarleton.teamdynamix.com/TDClient/2092/Carleton/KB/ArticleDet?ID=137062,Duo Two-Factor Authentication
Duo Setup: Tablet,https://stolafcarleton.teamdynamix.com/TDClient/2092/Carleton/KB/ArticleDet?ID=137063,Duo Two-Factor Authentication
Duo: Adding a new Device (e.g. got a new phone),https://stolafcarleton.teamdynamix.com/TDClient/2092/Carleton/KB/ArticleDet?ID=137898,Duo Two-Factor Authentication
Duo: Creating Backup Codes,https://stolafcarleton.teamdynamix.com/TDClient/2092/Carleton/KB/ArticleDet?ID=137067,Duo Two-Factor Authentication
Duo: Preparing to be Off Campus,https://stolafcarleton.teamdynamix.com/TDClient/2092/Carleton/KB/ArticleDet?ID=137066,Duo Two-Factor Authentication
"Duo: Remove ""Remember me"" cookie for Duo Two-Factor Authentication",https://stolafcarleton.teamdynamix.com/TDClient/2092/Carleton/KB/ArticleDet?ID=147747,Duo Two-Factor Authentication
Duo: Streamlining Authentication,https://stolafcarleton.teamdynamix.com/TDClient/2092/Carleton/KB/ArticleDet?ID=137068,Duo Two-Factor Authentication
Duo: Troubleshooting Duo not remembering you for 60 days,https://stolafcarleton.teamdynamix.com/TDClient/2092/Carleton/KB/ArticleDet?ID=140204,Duo Two-Factor Authentication
Changing your Carleton Password: Quick Start Guide,https://stolafcarleton.teamdynamix.com/TDClient/2092/Carleton/KB/ArticleDet?ID=140066,Changing Your Carleton Password
Changing your Carleton Password: Alumni,https://stolafcarleton.teamdynamix.com/TDClient/2092/Carleton/KB/ArticleDet?ID=146214,Changing Your Carleton Password
Changing your Carleton Password: Emeriti Faculty with Carleton-Issued Computers,https://stolafcarleton.teamdynamix.com/TDClient/2092/Carleton/KB/ArticleDet?ID=140731,Changing Your Carleton Password
Changing your Carleton Password: Faculty & Staff Off Campus,https://stolafcarleton.teamdynamix.com/TDClient/2092/Carleton/KB/ArticleDet?ID=140730,Changing Your Carleton Password
Changing your Carleton Password: Faculty & Staff On Campus,https://stolafcarleton.teamdynamix.com/TDClient/2092/Carleton/KB/ArticleDet?ID=140729,Changing Your Carleton Password
Changing your Carleton Password: New Students,https://stolafcarleton.teamdynamix.com/TDClient/2092/Carleton/KB/ArticleDet?ID=144165,Changing Your Carleton Password
"Changing your Carleton Password: Retirees with No Carleton-Issued Computers, Vendors & Guests with Carleton accounts",https://stolafcarleton.teamdynamix.com/TDClient/2092/Carleton/KB/ArticleDet?ID=140732,Changing Your Carleton Password
Changing your Carleton Password: Students Off Campus,https://stolafcarleton.teamdynamix.com/TDClient/2092/Carleton/KB/ArticleDet?ID=140725,Changing Your Carleton Password
Changing your Carleton Password: Students On Campus,https://stolafcarleton.teamdynamix.com/TDClient/2092/Carleton/KB/ArticleDet?ID=140724,Changing Your Carleton Password
macOS: Resyncing Your Computer to Your Carleton Password after a password change,https://stolafcarleton.teamdynamix.com/TDClient/2092/Carleton/KB/ArticleDet?ID=140734,Changing Your Carleton Password
Windows: Resyncing Your Computer's Password from Off Campus after a Password Change,https://stolafcarleton.teamdynamix.com/TDClient/2092/Carleton/KB/ArticleDet?ID=140735,Changing Your Carleton Password
After Changing Your Carleton Password,https://stolafcarleton.teamdynamix.com/TDClient/2092/Carleton/KB/ArticleDet?ID=140817,Changing Your Carleton Password
Archiving or Transferring Email,https://stolafcarleton.teamdynamix.com/TDClient/2092/Carleton/KB/ArticleDet?ID=143859,Email & Calendaring
Email: Archiving your email using Apple Mail,https://stolafcarleton.teamdynamix.com/TDClient/2092/Carleton/KB/ArticleDet?ID=143869,Email & Calendaring
Email: Archiving your email using MailStore,https://stolafcarleton.teamdynamix.com/TDClient/2092/Carleton/KB/ArticleDet?ID=143879,Email & Calendaring
Email: Granting Delegate Access to Your Email Account,https://stolafcarleton.teamdynamix.com/TDClient/2092/Carleton/KB/ArticleDet?ID=152259,Email & Calendaring
Email: Mail Merge,https://stolafcarleton.teamdynamix.com/TDClient/2092/Carleton/KB/ArticleDet?ID=150190,Email & Calendaring
Email: Setting an auto-reply in Gmail,https://stolafcarleton.teamdynamix.com/TDClient/2092/Carleton/KB/ArticleDet?ID=143853,Email & Calendaring
Email: Setting your Browser to be your Default Email Program,https://stolafcarleton.teamdynamix.com/TDClient/2092/Carleton/KB/ArticleDet?ID=155059,Email & Calendaring
Email: Sort and Evaluate Email by File Size,https://stolafcarleton.teamdynamix.com/TDClient/2092/Carleton/KB/ArticleDet?ID=148201,Email & Calendaring
"Email: Sort Email by Sender, Subject, and More",https://stolafcarleton.teamdynamix.com/TDClient/2092/Carleton/KB/ArticleDet?ID=148202,Email & Calendaring
Email: Transferring Carleton email to a personal Gmail account,https://stolafcarleton.teamdynamix.com/TDClient/2092/Carleton/KB/ArticleDet?ID=143858,Email & Calendaring
Email: Transferring very large email accounts,https://stolafcarleton.teamdynamix.com/TDClient/2092/Carleton/KB/ArticleDet?ID=144518,Email & Calendaring
Google Calendar: Import .ics files (especially from Workday Learning),https://stolafcarleton.teamdynamix.com/TDClient/2092/Carleton/KB/ArticleDet?ID=148899,Email & Calendaring
Google Groups: Adding a group to another group (nested groups),https://stolafcarleton.teamdynamix.com/TDClient/2092/Carleton/KB/ArticleDet?ID=154295,Email & Calendaring
Google Groups: Email Lists at Carleton,https://stolafcarleton.teamdynamix.com/TDClient/2092/Carleton/KB/ArticleDet?ID=142945,Email & Calendaring
Recent Changes to Google Workspaces (formerly Google Apps for Education),https://stolafcarleton.teamdynamix.com/TDClient/2092/Carleton/KB/ArticleDet?ID=137289&SIDs=10305,Email & Calendaring
Google Drive: Quick Start Guide,https://stolafcarleton.teamdynamix.com/TDClient/2092/Carleton/KB/ArticleDet?ID=146292&SIDs=11637,Google Drive
Google Drive: Carleton FileKeeper (carlfilekeeper@carleton.edu),https://stolafcarleton.teamdynamix.com/TDClient/2092/Carleton/KB/ArticleDet?ID=146558&SIDs=11637,Google Drive
Google Drive: Find and Delete Duplicate Files and Folders,https://stolafcarleton.teamdynamix.com/TDClient/2092/Carleton/KB/ArticleDet?ID=148200&SIDs=11637,Google Drive
Google Drive: Installing Google Drive for Desktop,https://stolafcarleton.teamdynamix.com/TDClient/2092/Carleton/KB/ArticleDet?ID=144940&SIDs=11637,Google Drive
Google Drive: Managing File Ownership,https://stolafcarleton.teamdynamix.com/TDClient/2092/Carleton/KB/ArticleDet?ID=146559&SIDs=11637,Google Drive
Google Drive: Sort and Evaluate Your Files by File Size,https://stolafcarleton.teamdynamix.com/TDClient/2092/Carleton/KB/ArticleDet?ID=148199&SIDs=11637,Google Drive
Google Drive: Three Main Sections of Google Drive,https://stolafcarleton.teamdynamix.com/TDClient/2092/Carleton/KB/ArticleDet?ID=146459&SIDs=11637,Google Drive
Google Drive: Transfer Ownership of Specific Files and Folders,https://stolafcarleton.teamdynamix.com/TDClient/2092/Carleton/KB/ArticleDet?ID=143872&SIDs=11637,Google Drive
Google Drive: Transferring or Archiving Google Drive Files and Folders,https://stolafcarleton.teamdynamix.com/TDClient/2092/Carleton/KB/ArticleDet?ID=143874&SIDs=11637,Google Drive
Google: How Much Storage Space am I Using?,https://stolafcarleton.teamdynamix.com/TDClient/2092/Carleton/KB/ArticleDet?ID=147939&SIDs=11637,Google Drive
Recent Changes to Google Workspaces (formerly Google Apps for Education),https://stolafcarleton.teamdynamix.com/TDClient/2092/Carleton/KB/ArticleDet?ID=137289&SIDs=11637,Google Drive
Grandstream Physical Phone: Quick Start Guide,https://stolafcarleton.teamdynamix.com/TDClient/2092/Carleton/KB/ArticleDet?ID=111713,Phones
Zulu Softphone: How to Use the Software (including signing in/out and basic functions),https://stolafcarleton.teamdynamix.com/TDClient/2092/Carleton/KB/ArticleDet?ID=111487,Phones
Zulu Softphone: Quick Start Guide,https://stolafcarleton.teamdynamix.com/TDClient/2092/Carleton/KB/ArticleDet?ID=111712,Phones
Accessing Voicemail,https://stolafcarleton.teamdynamix.com/TDClient/2092/Carleton/KB/ArticleDet?ID=111461,Phones
Call Forwarding,https://stolafcarleton.teamdynamix.com/TDClient/2092/Carleton/KB/ArticleDet?ID=111714,Phones
Dialing Guide for Internal (on-campus) and External (off-campus) Phone Numbers,https://stolafcarleton.teamdynamix.com/TDClient/2092/Carleton/KB/ArticleDet?ID=111686,Phones
Forward to Voicemail using Do Not Disturb,https://stolafcarleton.teamdynamix.com/TDClient/2092/Carleton/KB/ArticleDet?ID=111464,Phones
"Grandstream Physical Phone: Introduction to the phone, its features and shortcuts",https://stolafcarleton.teamdynamix.com/TDClient/2092/Carleton/KB/ArticleDet?ID=111444,Phones
Grandstream Physical Phone: Update Voicemail Greetings and Temporary Greeting,https://stolafcarleton.teamdynamix.com/TDClient/2092/Carleton/KB/ArticleDet?ID=111656,Phones
Logitech Headset Introduction,https://stolafcarleton.teamdynamix.com/TDClient/2092/Carleton/KB/ArticleDet?ID=111500&SIDs=10313,Phones
Manage your Phone Extension with the VoIP Dashboard,https://stolafcarleton.teamdynamix.com/TDClient/2092/Carleton/KB/ArticleDet?ID=111462,Phones
Telephone Headsets,https://stolafcarleton.teamdynamix.com/TDClient/2092/Carleton/KB/ArticleDet?ID=137360,Phones
Telephones in Faculty & Staff Campus Housing,https://stolafcarleton.teamdynamix.com/TDClient/2092/Carleton/KB/ArticleDet?ID=146175,Phones
Your Voicemail Password,https://stolafcarleton.teamdynamix.com/TDClient/2092/Carleton/KB/ArticleDet?ID=143544,Phones
Zulu Softphone: Installing Zulu on your computer,https://stolafcarleton.teamdynamix.com/TDClient/2092/Carleton/KB/ArticleDet?ID=140090,Phones
Zulu Softphone: Introduction to the buttons and screens,https://stolafcarleton.teamdynamix.com/TDClient/2092/Carleton/KB/ArticleDet?ID=140109,Phones
Zulu Softphone: Searching through Contacts,https://stolafcarleton.teamdynamix.com/TDClient/2092/Carleton/KB/ArticleDet?ID=137447,Phones
Zulu Softphone: Update Voicemail Greetings and Temporary Greeting,https://stolafcarleton.teamdynamix.com/TDClient/2092/Carleton/KB/ArticleDet?ID=111657,Phones
Zulu Softphone: Voicemail Setup,https://stolafcarleton.teamdynamix.com/TDClient/2092/Carleton/KB/ArticleDet?ID=111498,Phones
Instructions on how to use the Jabra Speak,https://stolafcarleton.teamdynamix.com/TDClient/2092/Carleton/KB/ArticleDet?ID=139058&SIDs=10469,Speakerphones
Crestron Wireless Presentation: Quick Start Guide,https://stolafcarleton.teamdynamix.com/TDClient/2092/Carleton/KB/ArticleDet?ID=142264&SIDs=10929,Wireless Presentation Technology
Crestron Wireless Presentation for Android: Using the AirMedia App,https://stolafcarleton.teamdynamix.com/TDClient/2092/Carleton/KB/ArticleDet?ID=142274&SIDs=10929,Wireless Presentation Technology
Crestron Wireless Presentation for iOS: Using the AirMedia App,https://stolafcarleton.teamdynamix.com/TDClient/2092/Carleton/KB/ArticleDet?ID=142270&SIDs=10929,Wireless Presentation Technology
