Article_Name,Link,Category_Under
Xerox: Secured Printing,https://stolafcarleton.teamdynamix.com/TDClient/2092/Carleton/KB/ArticleDet?ID=146879,Printing Smarter
Classroom Technology,https://stolafcarleton.teamdynamix.com/TDClient/2092/Carleton/KB/ArticleDet?ID=142282,Classroom Support
Language Lesson: Report an Issue,https://stolafcarleton.teamdynamix.com/TDClient/2092/Carleton/KB/ArticleDet?ID=140434,Language Lesson
Language Lesson: Student Tutorial,https://stolafcarleton.teamdynamix.com/TDClient/2092/Carleton/KB/ArticleDet?ID=140430,Language Lesson
Leaving Carleton - Your Personal/Class Websites,https://stolafcarleton.teamdynamix.com/TDClient/2092/Carleton/KB/ArticleDet?ID=143255,"CarlSites - WordPress, Omeka and Scalar"
"FlexWork: Communication, Calendars, and Setting Shared Expectations",https://stolafcarleton.teamdynamix.com/TDClient/2092/Carleton/KB/ArticleDet?ID=137230,FlexWork Technology
Preparing to Work from Off Campus,https://stolafcarleton.teamdynamix.com/TDClient/2092/Carleton/KB/ArticleDet?ID=137075,FlexWork Technology
Best Practices for Inclusive Meetings in Zoom or Google Meet,https://stolafcarleton.teamdynamix.com/TDClient/2092/Carleton/KB/ArticleDet?ID=137443,FlexWork Technology
Computer Equipment for Your Home Office,https://stolafcarleton.teamdynamix.com/TDClient/2092/Carleton/KB/ArticleDet?ID=137181,FlexWork Technology
Conferencing for Hybrid Teams: Audio and Video Setup,https://stolafcarleton.teamdynamix.com/TDClient/2092/Carleton/KB/ArticleDet?ID=137455,FlexWork Technology
Conferencing for Hybrid Teams: Conference-Ready Rooms,https://stolafcarleton.teamdynamix.com/TDClient/2092/Carleton/KB/ArticleDet?ID=137446,FlexWork Technology
Conferencing for Hybrid Teams: Requesting Equipment,https://stolafcarleton.teamdynamix.com/TDClient/2092/Carleton/KB/ArticleDet?ID=137163,FlexWork Technology
Core Communication Tools at Carleton,https://stolafcarleton.teamdynamix.com/TDClient/2092/Carleton/KB/ArticleDet?ID=137520,FlexWork Technology
GlobalProtect VPN: Installing and Connecting Your Carleton VPN,https://stolafcarleton.teamdynamix.com/TDClient/2092/Carleton/KB/ArticleDet?ID=137157&SIDs=10284,FlexWork Technology
Google Drive and Dropbox: Cloud File Storage for Remote and Hybrid Work,https://stolafcarleton.teamdynamix.com/TDClient/2092/Carleton/KB/ArticleDet?ID=137161,FlexWork Technology
How to Transport Your Computer Monitor,https://stolafcarleton.teamdynamix.com/TDClient/2092/Carleton/KB/ArticleDet?ID=137295,FlexWork Technology
Improving Home WiFi Connections,https://stolafcarleton.teamdynamix.com/TDClient/2092/Carleton/KB/ArticleDet?ID=136958,FlexWork Technology
Setting up a Cellular Hotspot for Mobile WiFi,https://stolafcarleton.teamdynamix.com/TDClient/2092/Carleton/KB/ArticleDet?ID=137080,FlexWork Technology
Standard Computing Equipment for Carleton Employees,https://stolafcarleton.teamdynamix.com/TDClient/2092/Carleton/KB/ArticleDet?ID=136901&SIDs=10250,FlexWork Technology
Troubleshooting Home WiFi Problems,https://stolafcarleton.teamdynamix.com/TDClient/2092/Carleton/KB/ArticleDet?ID=137079,FlexWork Technology
Zoom: Common Features and Functions,https://stolafcarleton.teamdynamix.com/TDClient/2092/Carleton/KB/ArticleDet?ID=137502&SIDs=10327,FlexWork Technology
Zoom: Tips and Tricks for Zoom Meetings,https://stolafcarleton.teamdynamix.com/TDClient/2092/Carleton/KB/ArticleDet?ID=137331&SIDs=10309,FlexWork Technology
Zulu Softphone: Quick Start Guide,https://stolafcarleton.teamdynamix.com/TDClient/2092/Carleton/KB/ArticleDet?ID=111712&SIDs=10312,FlexWork Technology
CrashPlan (formerly Code42): Install and Set Up your Cloud Backup Service,https://stolafcarleton.teamdynamix.com/TDClient/2092/Carleton/KB/ArticleDet?ID=134263&SIDs=10320,FlexWork Technology
GlobalProtect VPN: Installing and Connecting Your Carleton VPN,https://stolafcarleton.teamdynamix.com/TDClient/2092/Carleton/KB/ArticleDet?ID=137157&SIDs=10285,New Students
Moodle: Introduction for Students,https://stolafcarleton.teamdynamix.com/TDClient/2092/Carleton/KB/ArticleDet?ID=137542&SIDs=10334,New Students
New Students: Finding Your College ID,https://stolafcarleton.teamdynamix.com/TDClient/2092/Carleton/KB/ArticleDet?ID=144195,New Students
New Students: Quick Start Guide,https://stolafcarleton.teamdynamix.com/TDClient/2092/Carleton/KB/ArticleDet?ID=137493,New Students
Technology in Campus Housing for Faculty & Staff: Quick Start Guide,https://stolafcarleton.teamdynamix.com/TDClient/2092/Carleton/KB/ArticleDet?ID=146177,New Faculty
Leaving Carleton: Your Digital Departure,https://stolafcarleton.teamdynamix.com/TDClient/2092/Carleton/KB/ArticleDet?ID=143864,Digital Departures
Adobe: Creative Cloud Quick Start Guide,https://stolafcarleton.teamdynamix.com/TDClient/2092/Carleton/KB/ArticleDet?ID=136159,Adobe Creative Cloud
Adobe: License Eligibility,https://stolafcarleton.teamdynamix.com/TDClient/2092/Carleton/KB/ArticleDet?ID=136154,Adobe Creative Cloud
Adobe Sign: getting started,https://stolafcarleton.teamdynamix.com/TDClient/2092/Carleton/KB/ArticleDet?ID=138573,Adobe Creative Cloud
Adobe: Creating an ID,https://stolafcarleton.teamdynamix.com/TDClient/2092/Carleton/KB/ArticleDet?ID=136152,Adobe Creative Cloud
Adobe: Downloading the Creative Cloud Desktop Application,https://stolafcarleton.teamdynamix.com/TDClient/2092/Carleton/KB/ArticleDet?ID=136153,Adobe Creative Cloud
Adobe: Installing Applications,https://stolafcarleton.teamdynamix.com/TDClient/2092/Carleton/KB/ArticleDet?ID=136149,Adobe Creative Cloud
Adobe: Migrating Cloud Storage,https://stolafcarleton.teamdynamix.com/TDClient/2092/Carleton/KB/ArticleDet?ID=143946,Adobe Creative Cloud
Adobe: Migrating Creative Cloud Files,https://stolafcarleton.teamdynamix.com/TDClient/2092/Carleton/KB/ArticleDet?ID=144891,Adobe Creative Cloud
Adobe: Uninstalling Products,https://stolafcarleton.teamdynamix.com/TDClient/2092/Carleton/KB/ArticleDet?ID=136150,Adobe Creative Cloud
Troubleshooting Adobe licensing problems,https://stolafcarleton.teamdynamix.com/TDClient/2092/Carleton/KB/ArticleDet?ID=146940,Adobe Creative Cloud
Microsoft Office 365: Quick Start Guide,https://stolafcarleton.teamdynamix.com/TDClient/2092/Carleton/KB/ArticleDet?ID=134386,Microsoft Office
Microsoft Office for Faculty & Staff: Installation & Setup,https://stolafcarleton.teamdynamix.com/TDClient/2092/Carleton/KB/ArticleDet?ID=137538,Microsoft Office
Installing Microsoft Office 365 Applications on your Personal computer,https://stolafcarleton.teamdynamix.com/TDClient/2092/Carleton/KB/ArticleDet?ID=134388,Microsoft Office
Microsoft Office 365 Online Interface,https://stolafcarleton.teamdynamix.com/TDClient/2092/Carleton/KB/ArticleDet?ID=134389,Microsoft Office
Microsoft Office: Auto Updating,https://stolafcarleton.teamdynamix.com/TDClient/2092/Carleton/KB/ArticleDet?ID=137539,Microsoft Office
"Microsoft Office: Mobile (for iPad, iPhone, or Android)",https://stolafcarleton.teamdynamix.com/TDClient/2092/Carleton/KB/ArticleDet?ID=134390,Microsoft Office
Microsoft Office: Resources and Support,https://stolafcarleton.teamdynamix.com/TDClient/2092/Carleton/KB/ArticleDet?ID=134392,Microsoft Office
Microsoft Office: Uninstalling,https://stolafcarleton.teamdynamix.com/TDClient/2092/Carleton/KB/ArticleDet?ID=137945,Microsoft Office
Microsoft Windows: Troubleshooting Notifications Requiring that You Activate Windows,https://stolafcarleton.teamdynamix.com/TDClient/2092/Carleton/KB/ArticleDet?ID=140928,Microsoft Office
Troubleshooting: Office error saying your product is unlicensed,https://stolafcarleton.teamdynamix.com/TDClient/2092/Carleton/KB/ArticleDet?ID=146479,Microsoft Office
Microsoft Office: For Faculty & Staff Preparing to Leave Carleton,https://stolafcarleton.teamdynamix.com/TDClient/2092/Carleton/KB/ArticleDet?ID=134391,Microsoft Office
Zoom: Common Features and Functions,https://stolafcarleton.teamdynamix.com/TDClient/2092/Carleton/KB/ArticleDet?ID=137502&SIDs=10338,Zoom Conferencing
Zoom: Installation & Set-up,https://stolafcarleton.teamdynamix.com/TDClient/2092/Carleton/KB/ArticleDet?ID=137095&SIDs=10338,Zoom Conferencing
Best Practices for Inclusive Meetings in Zoom or Google Meet,https://stolafcarleton.teamdynamix.com/TDClient/2092/Carleton/KB/ArticleDet?ID=137443&SIDs=10338%2c10328,Zoom Conferencing
Windows Defender Firewall blocking certain features of Zoom,https://stolafcarleton.teamdynamix.com/TDClient/2092/Carleton/KB/ArticleDet?ID=142988&SIDs=10338,Zoom Conferencing
Zoom Licenses at Carleton,https://stolafcarleton.teamdynamix.com/TDClient/2092/Carleton/KB/ArticleDet?ID=137329&SIDs=10338,Zoom Conferencing
Zoom: Checking for Updates,https://stolafcarleton.teamdynamix.com/TDClient/2092/Carleton/KB/ArticleDet?ID=137093&SIDs=10338,Zoom Conferencing
Zoom: Closed Captioning,https://stolafcarleton.teamdynamix.com/TDClient/2092/Carleton/KB/ArticleDet?ID=137373&SIDs=10338,Zoom Conferencing
Zoom: Collecting logs to assist Zoom engineers in diagnostics for repeated failures,https://stolafcarleton.teamdynamix.com/TDClient/2092/Carleton/KB/ArticleDet?ID=140269&SIDs=10338,Zoom Conferencing
Zoom: General Guidelines for Classrooms,https://stolafcarleton.teamdynamix.com/TDClient/2092/Carleton/KB/ArticleDet?ID=137158&SIDs=10338,Zoom Conferencing
Zoom: How to Sign In with your Carleton Account,https://stolafcarleton.teamdynamix.com/TDClient/2092/Carleton/KB/ArticleDet?ID=134249&SIDs=10338,Zoom Conferencing
Zoom: Large Group Meeting License,https://stolafcarleton.teamdynamix.com/TDClient/2092/Carleton/KB/ArticleDet?ID=137094&SIDs=10338,Zoom Conferencing
Zoom: Meeting Recordings,https://stolafcarleton.teamdynamix.com/TDClient/2092/Carleton/KB/ArticleDet?ID=141613&SIDs=10338,Zoom Conferencing
Zoom: Recording to the Cloud,https://stolafcarleton.teamdynamix.com/TDClient/2092/Carleton/KB/ArticleDet?ID=143799&SIDs=10338,Zoom Conferencing
Zoom: Tips and Tricks for Zoom Meetings,https://stolafcarleton.teamdynamix.com/TDClient/2092/Carleton/KB/ArticleDet?ID=137331&SIDs=10338,Zoom Conferencing
"Zoom: Workaround for ""Unable to Connect to Network""- Joining from Your Browser",https://stolafcarleton.teamdynamix.com/TDClient/2092/Carleton/KB/ArticleDet?ID=138488&SIDs=10338,Zoom Conferencing
macOS: Upgrading Your Operating System Quick Start Guide,https://stolafcarleton.teamdynamix.com/TDClient/2092/Carleton/KB/ArticleDet?ID=134277,macOS
macOS Upgrade: Known Issues,https://stolafcarleton.teamdynamix.com/TDClient/2092/Carleton/KB/ArticleDet?ID=136557,macOS
macOS: After you Upgrade,https://stolafcarleton.teamdynamix.com/TDClient/2092/Carleton/KB/ArticleDet?ID=136556,macOS
macOS: Checking your Applications,https://stolafcarleton.teamdynamix.com/TDClient/2092/Carleton/KB/ArticleDet?ID=136552,macOS
macOS: Checking your Disk,https://stolafcarleton.teamdynamix.com/TDClient/2092/Carleton/KB/ArticleDet?ID=136554,macOS
macOS: Running the Upgrade,https://stolafcarleton.teamdynamix.com/TDClient/2092/Carleton/KB/ArticleDet?ID=136555,macOS
macOS: Which macOS do I have?,https://stolafcarleton.teamdynamix.com/TDClient/2092/Carleton/KB/ArticleDet?ID=148734,macOS
Updating Your Windows 10 or 11 Version,https://stolafcarleton.teamdynamix.com/TDClient/2092/Carleton/KB/ArticleDet?ID=134289,Windows
Adobe Acrobat Pro replaces Adobe Reader,https://stolafcarleton.teamdynamix.com/TDClient/2092/Carleton/KB/ArticleDet?ID=145484,Windows
BitLocker: Installation and Setup,https://stolafcarleton.teamdynamix.com/TDClient/2092/Carleton/KB/ArticleDet?ID=137540,Windows
Lenovo: Troubleshooting issue where Thunderbolt Firmware update does not install,https://stolafcarleton.teamdynamix.com/TDClient/2092/Carleton/KB/ArticleDet?ID=141731,Windows
Troubleshooting: Windows Smart Screen Protection,https://stolafcarleton.teamdynamix.com/TDClient/2092/Carleton/KB/ArticleDet?ID=136384,Windows
Windows 10 or 11 Update Process,https://stolafcarleton.teamdynamix.com/TDClient/2092/Carleton/KB/ArticleDet?ID=134280,Windows
Windows: Apple Software Update,https://stolafcarleton.teamdynamix.com/TDClient/2092/Carleton/KB/ArticleDet?ID=136558,Windows
Windows: Check Your Windows Version,https://stolafcarleton.teamdynamix.com/TDClient/2092/Carleton/KB/ArticleDet?ID=136815,Windows
Windows: Fixing a blank blue screen that appears on startup,https://stolafcarleton.teamdynamix.com/TDClient/2092/Carleton/KB/ArticleDet?ID=136975,Windows
Windows: How to Run the Update Assistant,https://stolafcarleton.teamdynamix.com/TDClient/2092/Carleton/KB/ArticleDet?ID=136818,Windows
Windows: How to Verify Your Free Disk Space,https://stolafcarleton.teamdynamix.com/TDClient/2092/Carleton/KB/ArticleDet?ID=136798,Windows
Windows: Installing Driver Updates on a Surface Laptop,https://stolafcarleton.teamdynamix.com/TDClient/2092/Carleton/KB/ArticleDet?ID=136692,Windows
Windows: Lenovo and Lenovo Dock Updates,https://stolafcarleton.teamdynamix.com/TDClient/2092/Carleton/KB/ArticleDet?ID=136515,Windows
Windows: Patching Schedule,https://stolafcarleton.teamdynamix.com/TDClient/2092/Carleton/KB/ArticleDet?ID=136789,Windows
Windows: Updating Dell Drivers and BIOS,https://stolafcarleton.teamdynamix.com/TDClient/2092/Carleton/KB/ArticleDet?ID=136525,Windows
Windows: Using an Apple USB SuperDrive from the Equipment Checkout Center (ECC),https://stolafcarleton.teamdynamix.com/TDClient/2092/Carleton/KB/ArticleDet?ID=141656,Windows
Moodle Placement Test Reports,https://stolafcarleton.teamdynamix.com/TDClient/2092/Carleton/KB/ArticleDet?ID=153949,For Instructors
Moodle Dashboard,https://stolafcarleton.teamdynamix.com/TDClient/2092/Carleton/KB/ArticleDet?ID=146409&SIDs=11720,For Students
Moodle: How to Set Up Personal Pronouns,https://stolafcarleton.teamdynamix.com/TDClient/2092/Carleton/KB/ArticleDet?ID=145218&SIDs=11721,For Students
Moodle: Introduction for Students,https://stolafcarleton.teamdynamix.com/TDClient/2092/Carleton/KB/ArticleDet?ID=137542,For Students
Moodle: Downloading your Content,https://stolafcarleton.teamdynamix.com/TDClient/2092/Carleton/KB/ArticleDet?ID=143875,For Students
Moodle: Moodle Themes and Formats,https://stolafcarleton.teamdynamix.com/TDClient/2092/Carleton/KB/ArticleDet?ID=147163,For Students
Crestron Wireless Presentation: Quick Start Guide,https://stolafcarleton.teamdynamix.com/TDClient/2092/Carleton/KB/ArticleDet?ID=142264,Wireless Presentation Technology
Crestron Wireless Presentation for Android: Using the AirMedia App,https://stolafcarleton.teamdynamix.com/TDClient/2092/Carleton/KB/ArticleDet?ID=142274,Wireless Presentation Technology
Crestron Wireless Presentation for iOS: Using the AirMedia App,https://stolafcarleton.teamdynamix.com/TDClient/2092/Carleton/KB/ArticleDet?ID=142270,Wireless Presentation Technology
Crestron Wireless Presentation for macOS: Using the AirMedia App,https://stolafcarleton.teamdynamix.com/TDClient/2092/Carleton/KB/ArticleDet?ID=142267,Wireless Presentation Technology
Crestron Wireless Presentation for Windows: Using the AirMedia App,https://stolafcarleton.teamdynamix.com/TDClient/2092/Carleton/KB/ArticleDet?ID=142268,Wireless Presentation Technology
Crestron Wireless Presentation: Installing the AirMedia App,https://stolafcarleton.teamdynamix.com/TDClient/2092/Carleton/KB/ArticleDet?ID=142265,Wireless Presentation Technology
Crestron Wireless Presentation: Troubleshooting,https://stolafcarleton.teamdynamix.com/TDClient/2092/Carleton/KB/ArticleDet?ID=150189,Wireless Presentation Technology
Teaching Station: The projection isn't showing...,https://stolafcarleton.teamdynamix.com/TDClient/2092/Carleton/KB/ArticleDet?ID=150246,Troubleshooting FAQ  for Teaching Stations
Teaching Station: The sound isn't playing...,https://stolafcarleton.teamdynamix.com/TDClient/2092/Carleton/KB/ArticleDet?ID=150245,Troubleshooting FAQ  for Teaching Stations
Crestron Wireless Presentation: Troubleshooting,https://stolafcarleton.teamdynamix.com/TDClient/2092/Carleton/KB/ArticleDet?ID=150189&SIDs=11711,Troubleshooting FAQ  for Teaching Stations
Teaching Station: The camera/mic system isn't here/working like I expect...,https://stolafcarleton.teamdynamix.com/TDClient/2092/Carleton/KB/ArticleDet?ID=150334,Troubleshooting FAQ  for Teaching Stations
Teaching Station: The Blu-ray isn't working...,https://stolafcarleton.teamdynamix.com/TDClient/2092/Carleton/KB/ArticleDet?ID=150270,Troubleshooting FAQ  for Teaching Stations
Teaching Station: The document camera isn't here/displaying...,https://stolafcarleton.teamdynamix.com/TDClient/2092/Carleton/KB/ArticleDet?ID=150332,Troubleshooting FAQ  for Teaching Stations
"Teaching Station: Screens, Lights, and Motorized Shades",https://stolafcarleton.teamdynamix.com/TDClient/2092/Carleton/KB/ArticleDet?ID=150412,Troubleshooting FAQ  for Teaching Stations
CarlSites: Terms and Definitions,https://stolafcarleton.teamdynamix.com/TDClient/2092/Carleton/KB/ArticleDet?ID=141612,Carlsites: Start Here
CarlSites: Getting Started,https://stolafcarleton.teamdynamix.com/TDClient/2092/Carleton/KB/ArticleDet?ID=148027,Carlsites: Start Here
CarlSites: Technical Guide,https://stolafcarleton.teamdynamix.com/TDClient/2092/Carleton/KB/ArticleDet?ID=148028,Carlsites: Start Here
CarlSites: cPanel Theme Change,https://stolafcarleton.teamdynamix.com/TDClient/2092/Carleton/KB/ArticleDet?ID=141306,Carlsites: Start Here
Your Sites and the Great Password Change,https://stolafcarleton.teamdynamix.com/TDClient/2092/Carleton/KB/ArticleDet?ID=141359,Carlsites: Start Here
CarlSites: Understanding the cPanel,https://stolafcarleton.teamdynamix.com/TDClient/2092/Carleton/KB/ArticleDet?ID=151360,cPanel
CarlSites: cPanel Theme Change,https://stolafcarleton.teamdynamix.com/TDClient/2092/Carleton/KB/ArticleDet?ID=141306&SIDs=11871,cPanel
Carlsites: Installing Free SSL Certificates,https://stolafcarleton.teamdynamix.com/TDClient/2092/Carleton/KB/ArticleDet?ID=150796,cPanel
CarlSites Omeka: New Site Guide,https://stolafcarleton.teamdynamix.com/TDClient/2092/Carleton/KB/ArticleDet?ID=150655,Omeka
CarlSites: Adding & Managing Users on Omeka,https://stolafcarleton.teamdynamix.com/TDClient/2092/Carleton/KB/ArticleDet?ID=150660,Omeka
CarlSites: Adding Exhibits in Omeka,https://stolafcarleton.teamdynamix.com/TDClient/2092/Carleton/KB/ArticleDet?ID=150653,Omeka
CarlSites: Omeka Setup Guide,https://stolafcarleton.teamdynamix.com/TDClient/2092/Carleton/KB/ArticleDet?ID=154371,Omeka
Carlsites WordPress: New Site Guide,https://stolafcarleton.teamdynamix.com/TDClient/2092/Carleton/KB/ArticleDet?ID=150661,WordPress
Moodle Dashboard,https://stolafcarleton.teamdynamix.com/TDClient/2092/Carleton/KB/ArticleDet?ID=146409,Moodle Basics
Moodle: How to Set Up Personal Pronouns,https://stolafcarleton.teamdynamix.com/TDClient/2092/Carleton/KB/ArticleDet?ID=145218,Moodle Basics
Moodle: Making grades visible to students,https://stolafcarleton.teamdynamix.com/TDClient/2092/Carleton/KB/ArticleDet?ID=150038&SIDs=11680,Moodle Basics
Moodle: Making your Course Visible to Students,https://stolafcarleton.teamdynamix.com/TDClient/2092/Carleton/KB/ArticleDet?ID=148507,Moodle Basics
Moodle: Course Settings,https://stolafcarleton.teamdynamix.com/TDClient/2092/Carleton/KB/ArticleDet?ID=134591,Moodle Basics
"Moodle: Course Themes, Formats, and Blocks",https://stolafcarleton.teamdynamix.com/TDClient/2092/Carleton/KB/ArticleDet?ID=136312&SIDs=11520,Moodle Basics
Moodle: Import Course Materials,https://stolafcarleton.teamdynamix.com/TDClient/2092/Carleton/KB/ArticleDet?ID=135859&SIDs=11522,Moodle Basics
Moodle: Setting up the Gradebook,https://stolafcarleton.teamdynamix.com/TDClient/2092/Carleton/KB/ArticleDet?ID=135898&SIDs=11521,Moodle Basics
Moodle: Working with Media,https://stolafcarleton.teamdynamix.com/TDClient/2092/Carleton/KB/ArticleDet?ID=141011,Moodle Basics
"Moodle: Course Themes, Formats, and Blocks",https://stolafcarleton.teamdynamix.com/TDClient/2092/Carleton/KB/ArticleDet?ID=136312,Course Layout
Moodle: Blocks,https://stolafcarleton.teamdynamix.com/TDClient/2092/Carleton/KB/ArticleDet?ID=138593,Course Layout
Moodle: Carleton Boost Theme,https://stolafcarleton.teamdynamix.com/TDClient/2092/Carleton/KB/ArticleDet?ID=140567,Course Layout
Moodle: Fordson Theme,https://stolafcarleton.teamdynamix.com/TDClient/2092/Carleton/KB/ArticleDet?ID=139350,Course Layout
Moodle: Moove Theme,https://stolafcarleton.teamdynamix.com/TDClient/2092/Carleton/KB/ArticleDet?ID=139352,Course Layout
Moodle: Weekly Course Format,https://stolafcarleton.teamdynamix.com/TDClient/2092/Carleton/KB/ArticleDet?ID=136318,Course Layout
Moodle: Topics Course Format,https://stolafcarleton.teamdynamix.com/TDClient/2092/Carleton/KB/ArticleDet?ID=136321,Course Layout
Moodle: Buttons Course Format,https://stolafcarleton.teamdynamix.com/TDClient/2092/Carleton/KB/ArticleDet?ID=136326,Course Layout
Moodle: Flexible Sections Course Format,https://stolafcarleton.teamdynamix.com/TDClient/2092/Carleton/KB/ArticleDet?ID=135809,Course Layout
Moodle: Tiles Course Format,https://stolafcarleton.teamdynamix.com/TDClient/2092/Carleton/KB/ArticleDet?ID=138565,Course Layout
Moodle: Single Activity Course Format,https://stolafcarleton.teamdynamix.com/TDClient/2092/Carleton/KB/ArticleDet?ID=138567,Course Layout
Moodle: Social Course Format,https://stolafcarleton.teamdynamix.com/TDClient/2092/Carleton/KB/ArticleDet?ID=138822,Course Layout
Moodle: Creating custom scales for grading,https://stolafcarleton.teamdynamix.com/TDClient/2092/Carleton/KB/ArticleDet?ID=148214,All about Grading
Moodle: Downloading your Gradebook,https://stolafcarleton.teamdynamix.com/TDClient/2092/Carleton/KB/ArticleDet?ID=151890,All about Grading
Moodle: Making grades visible to students,https://stolafcarleton.teamdynamix.com/TDClient/2092/Carleton/KB/ArticleDet?ID=150038,All about Grading
Moodle: Setting up the Gradebook,https://stolafcarleton.teamdynamix.com/TDClient/2092/Carleton/KB/ArticleDet?ID=135898,All about Grading
Moodle: Grading Interface: Assignment vs Gradebook,https://stolafcarleton.teamdynamix.com/TDClient/2092/Carleton/KB/ArticleDet?ID=138715,All about Grading
Moodle: Quiz - Basic Guide,https://stolafcarleton.teamdynamix.com/TDClient/2092/Carleton/KB/ArticleDet?ID=138598,Quizzing
Moodle: Quiz - Question Bank,https://stolafcarleton.teamdynamix.com/TDClient/2092/Carleton/KB/ArticleDet?ID=141253,Quizzing
Moodle: Quiz - Automatic and Manual Grading,https://stolafcarleton.teamdynamix.com/TDClient/2092/Carleton/KB/ArticleDet?ID=141893,Quizzing
Moodle: Adding Non @carleton Participants,https://stolafcarleton.teamdynamix.com/TDClient/2092/Carleton/KB/ArticleDet?ID=134437,Enrollments
Moodle: Course Sites and Enrollments,https://stolafcarleton.teamdynamix.com/TDClient/2092/Carleton/KB/ArticleDet?ID=145873,Enrollments
Moodle: Linking to a Metacourse,https://stolafcarleton.teamdynamix.com/TDClient/2092/Carleton/KB/ArticleDet?ID=148578,Enrollments
Moodle: Enrollments,https://stolafcarleton.teamdynamix.com/TDClient/2092/Carleton/KB/ArticleDet?ID=138955,Enrollments
Moodle: Roles and Permissions,https://stolafcarleton.teamdynamix.com/TDClient/2092/Carleton/KB/ArticleDet?ID=138792,Enrollments
Moodle: Groups and Groupings,https://stolafcarleton.teamdynamix.com/TDClient/2092/Carleton/KB/ArticleDet?ID=138476,Group Activities
Moodle: Access Restriction,https://stolafcarleton.teamdynamix.com/TDClient/2092/Carleton/KB/ArticleDet?ID=140854&SIDs=11644,Group Activities
Moodle: Setting up Moodle Scheduler,https://stolafcarleton.teamdynamix.com/TDClient/2092/Carleton/KB/ArticleDet?ID=146392,Group Activities
Moodle: Course Backup,https://stolafcarleton.teamdynamix.com/TDClient/2092/Carleton/KB/ArticleDet?ID=134578,Course Reuse
Moodle: Import Course Materials,https://stolafcarleton.teamdynamix.com/TDClient/2092/Carleton/KB/ArticleDet?ID=135859,Course Reuse
Moodle: Options for Limiting Student Access,https://stolafcarleton.teamdynamix.com/TDClient/2092/Carleton/KB/ArticleDet?ID=141617,Completion Tracking & Access Restriction
Moodle: Activity Completion,https://stolafcarleton.teamdynamix.com/TDClient/2092/Carleton/KB/ArticleDet?ID=146461,Completion Tracking & Access Restriction
Moodle: Course Completion,https://stolafcarleton.teamdynamix.com/TDClient/2092/Carleton/KB/ArticleDet?ID=154128,Completion Tracking & Access Restriction
Moodle: Access Restriction,https://stolafcarleton.teamdynamix.com/TDClient/2092/Carleton/KB/ArticleDet?ID=140854,Completion Tracking & Access Restriction
Adobe Acrobat Pro: Running PDF Document Accessibility Checks & Accessibility Quick Fixes,https://stolafcarleton.teamdynamix.com/TDClient/2092/Carleton/KB/ArticleDet?ID=147971,Ally for Moodle
Adobe Acrobat Pro: Turning Files into Editable Text and Images,https://stolafcarleton.teamdynamix.com/TDClient/2092/Carleton/KB/ArticleDet?ID=148024,Ally for Moodle
Adobe Acrobat Pro: Properly Tagging Page Content & Setting Alternate Text for Figures,https://stolafcarleton.teamdynamix.com/TDClient/2092/Carleton/KB/ArticleDet?ID=148037,Ally for Moodle
Adobe Acrobat Pro: Correcting Document Color Contrast Issues,https://stolafcarleton.teamdynamix.com/TDClient/2092/Carleton/KB/ArticleDet?ID=148143,Ally for Moodle
Moodle: Gradescope integration,https://stolafcarleton.teamdynamix.com/TDClient/2092/Carleton/KB/ArticleDet?ID=154147,External Tools
Uploading a video from your iPad to Moodle,https://stolafcarleton.teamdynamix.com/TDClient/2092/Carleton/KB/ArticleDet?ID=154540,iPad + Moodle
Moodle: Quiz - Automatic and Manual Grading,https://stolafcarleton.teamdynamix.com/TDClient/2092/Carleton/KB/ArticleDet?ID=141893&SIDs=11722,Student TAs
